Code,Name,Properties,Description
C00,Wire,{},"A wire serves as the essential conduit for electrical signals within a circuit. Its primary function is to establish a conductive path enabling the flow of electrons between components. Wires come in various sizes and materials each tailored to specific applications. Whether in simple point-to-point connections or complex networked circuits wires form the backbone of electronic systems."
C01,Resistor,{},"A resistor is a passive electrical component that restricts the flow of electric current. Its role is crucial in controlling current levels dividing voltages and setting bias points in circuits. Resistor values are measured in ohms and they come in various types including fixed and variable resistors. Understanding resistor properties is fundamental for circuit design ensuring proper functionality and stability."
C02,Switch,{},"A switch is a fundamental electronic component that controls the flow of electrical current in a circuit. It acts as a binary device allowing the circuit to be either open or closed. Switches are used for turning devices on and off changing circuit configurations and controlling electronic systems. Their versatility and simplicity make them indispensable in various applications."
C03,LED,{},"A Light-Emitting Diode (LED) is a semiconductor device that emits light when an electric current passes through it. LEDs are widely used for indicators displays and lighting applications. Their efficiency durability and ability to emit different colors make them integral to modern electronics. Understanding the characteristics of LEDs is crucial for effective integration into electronic circuits."
C04,Diode,{},"A diode is a semiconductor device that allows current to flow in one direction only. It serves as a rectifier converting alternating current (AC) to direct current (DC) and is essential in various applications including power supplies and signal demodulation. Diodes play a vital role in shaping electrical waveforms and ensuring the proper functioning of electronic systems."
C05,Cell,{},"A cell is a device that generates electrical energy through chemical reactions. Cells are the building blocks of batteries and are widely used to power electronic devices. Understanding cell characteristics such as voltage and capacity is crucial for selecting the right power source for different applications."
C06,Button,{},"A button also known as a push-button or switch is a momentary control device that when pressed completes or interrupts an electric circuit. Buttons are commonly used for user input control interfaces and triggering specific actions in electronic systems. Their simplicity and reliability make them prevalent in various devices."
C07,Ammeter,{},"An ammeter is a measuring instrument used to quantify the flow of electric current in a circuit. It is connected in series with the circuit under analysis and provides crucial information about current levels. Ammeters play a vital role in circuit diagnostics ensuring that current values align with design specifications."
C08,Voltmeter,{},"A voltmeter is an instrument used to measure the voltage across components or points in an electrical circuit. It is connected in parallel to the circuit under examination and provides valuable information about voltage levels. Voltmeters are essential tools for diagnosing electrical issues and verifying circuit performance."
C09,Potentiometer,{},"A potentiometer commonly known as a pot is a three-terminal resistor with a sliding or rotating contact. It acts as a variable resistor allowing the user to adjust the resistance value by changing the position of the contact along the resistive element. Potentiometers find applications in volume control tone adjustment and sensor calibration in electronic circuits."
C10,Capacitor,{},"A capacitor is an electronic component that stores electrical energy in an electric field. It consists of two conductive plates separated by an insulating material called the dielectric. Capacitors have various applications including energy storage filtering and coupling in electronic circuits. Understanding capacitor properties is crucial for designing circuits with specific timing and signal conditioning requirements."
C11,Transformer,{},"A transformer is an electrical device that transfers electrical energy between two or more circuits through electromagnetic induction. It consists of primary and secondary coils linked by a magnetic core. Transformers are essential for voltage conversion power distribution and impedance matching in electronic and electrical systems."
C12,NPN Transistor,{},"An NPN transistor is a semiconductor device with three layers of semiconductor material: the emitter base and collector. NPN transistors are widely used for amplification and switching in electronic circuits. Understanding the principles of NPN transistor operation is essential for designing and analyzing circuits."
C13,PNP Transistor,{},"A PNP transistor is a semiconductor device similar to an NPN transistor but with a different arrangement of layers. PNP transistors are also used for amplification and switching in electronic circuits. Understanding the principles of PNP transistor operation is crucial for circuit design and analysis."
C14,Variable Resistor,{},"A variable resistor is a resistor whose resistance can be adjusted manually. It allows for dynamic control of resistance in a circuit providing flexibility in electronic system design. Variable resistors such as potentiometers find applications in volume control dimmer switches and tuning circuits."
C15,NOT,{},"A NOT gate also known as an inverter is a fundamental logic gate that produces an output that is the logical opposite of its input. It is a building block for constructing more complex digital circuits. Understanding the operation of NOT gates is crucial for designing logical circuits."
C16,AND,{},"An AND gate is a logic gate that produces a high output only when all of its inputs are high. AND gates are fundamental in digital circuit design performing logical conjunction operations. They are essential for creating complex logic functions."
C17,NAND,{},"A NAND gate is a logic gate that produces a low output only when all of its inputs are high. NAND gates are versatile building blocks for constructing digital circuits and they can be used to create any other logic gate. Understanding NAND gate operation is fundamental for digital circuit design."
C18,XOR,{},"An XOR gate or exclusive OR gate produces a high output when the number of high inputs is odd. XOR gates are fundamental in digital circuitry used for various applications including binary addition and data comparison. Understanding XOR gate behavior is crucial for designing logical circuits."
C19,NOR,{},"A NOR gate is a logic gate that produces a low output only when all of its inputs are high. NOR gates are essential in digital circuit design and they can be used to create other logic gates. Understanding NOR gate operation is fundamental for constructing complex logic functions."
